[
    {
        "components": "SUSPENSION",
        "crash": false,
        "dateComplaintFiled": "05/15/2009",
        "dateOfIncident": "05/10/2009",
        "fire": false,
        "manufacturer": "Ford Motor Company",
        "numberOfDeaths": 0,
        "numberOfInjuries": 0,
        "odiNumber": 10268814,
        "products": [
            {
                "manufacturer": "Ford Motor Company",
                "productMake": "FORD",
                "productModel": "TAURUS",
                "productYear": "2002",
                "type": "Vehicle"
            }
        ],
        "summary": "CAR: 2002 FORD TAURUS SES   INDECENT: EXITING DRIVEWAY AND HEARD LOUD NOISE, THAT SHOOK THE CAR, PULLED OVER AND DISCOVERED FRONT DRIVERS SIDE SPRING HAD BROKEN, IN TURN HITTING TIRE AND AND BRAKING SWAY BAR.   NOTE:JULY 15, 2004 | RECALL ID# 15302 HIDE DETAILS   RECALL REASONSUSPENSION:FRONT:SPRINGS:COIL SPRINGS  RECALL DATEJULY 15, 2004  MODEL AFFECTEDTAURUS  POTENTIAL UNITS AFFECTED 899060  RECALL SUMMARY  ON CERTAIN PASSENGER VEHICLES ORIGINALLY SOLD IN OR CURRENTLY REGISTERED IN THE STATES OF CONNECTICUT, DELAWARE, ILLINOIS, INDIANA, IOWA, KENTUCKY, MAINE, MARYLAND, MASSACHUSETTS, MICHIGAN, MINNESOTA, MISSOURI, NEW HAMPSHIRE, NEW JERSEY, NEW YORK, OHIO, PENNSYLVANIA, RHODE ISLAND, VERMONT, WEST VIRGINIA, WISCONSIN, AND THE DISTRICT OF COLUMBIA, THE FRONT COIL SPRINGS COULD FRACTURE DUE TO CORROSION ASSOCIATED WITH SALT USED ON THE ROADWAYS DURING THE WINTER. A FRACTURED SPRING COULD MOVE PAST THE SPRING SEAT AND CONTACT A FRONT TIRE.   CONSEQUENCE  IF THIS OCCURS, THE TIRE MAY RUPTURE RESULTING IN A RAPID AIR LOSS, WHICH COULD RESULT IN A CRASH.   REMEDY  DEALERS WILL INSTALL PROTECTIVE SPRING SHIELDS. IN ADDITION, FORD IS EXTENDING THE WARRANTY COVERAGE OF THE FRONT COIL SPRINGS IN ALL OTHER STATES, FOR FRACTURE ONLY, UP TO 10 YEARS OF SERVICE OR 150,000 MILES, WHICHEVER OCCURS FIRST. IF THE VEHICLE HAS ALREADY ACCUMULATED MORE THAN 150,000 MILES, THIS COVERAGE WILL LAST UNTIL JULY 31, 2005. IF EITHER FRONT COIL SPRING FRACTURES, DEALERS WILL REPLACE BOTH FRONT SPRINGS AT NO CHARGE TO THE OWNER. AN INTERIM NOTICE WAS SENT TO OWNERS ON AUGUST 2, 2004. PARTS ARE NOW AVAILABLE FOR THE 2000-2001 MY VEHICLES AND OWNERS WERE SENT A LETTER ON JANUARY 10, 2005, ADVISING THEM TO BRING IN THEIR VEHICLES FOR REPAIR PARTS ARE EXPECTED TO BE AVAILABLE FOR THE 1999 MY VEHICLES BY THE END OF FEBRUARY 2005 AND OWNERS OF THESE VEHICLES WILL BE NOTIFIED THEN. OWNERS SHOULD CONTACT FORD AT 1-800-392-3673.   FORD MOTOR COMPANY 04S17  MY CAR HAS THE SAME ISSUE, BUT WITH THE HAS THE PLATE.*TR",
        "vin": "1FAFP55U22G"
    }
]