[
    {
        "components": "SUSPENSION",
        "crash": false,
        "dateComplaintFiled": "08/24/2009",
        "dateOfIncident": "08/20/2009",
        "fire": false,
        "manufacturer": "Ford Motor Company",
        "numberOfDeaths": 0,
        "numberOfInjuries": 0,
        "odiNumber": 10281514,
        "products": [
            {
                "manufacturer": "Ford Motor Company",
                "productMake": "FORD",
                "productModel": "TAURUS",
                "productYear": "2000",
                "type": "Vehicle"
            }
        ],
        "summary": "TL*THE CONTACT OWNS A 2000 FORD TAURUS.  WHILE TRAVELING AT 35MPH THE VEHICLE STARTED TO SHAKE AND VIBRATE.  IT WAS DIFFICULT TO CONTROL.  HE PULLED THE VEHICLE OVER AND NOTICED THAT THE REAR PASSENGER SIDE WAS LOWER IN THE WHEEL BASE THAN THE FRONT SIDE.  THE VEHICLE WAS DRIVEN TO THE NEAREST MECHANIC.  THE TECHNICIAN STATED THAT THE REAR COIL SPRINGS HAD FAILED AND IT SHOULD NOT BE DRIVEN UNTIL IT WAS REPAIRED.  HE WAS THEN EXPLAINED OF A RECALL THAT WAS ALREADY ISSUED ON THE VEHICLE, BUT IT WAS ON THE FRONT COIL SPRINGS (MANUFACTURER: FORD MOTOR COMPANY MFR'S REPORT DATE: JUL 06, 2004 NHTSA CAMPAIGN ID NUMBER: 04V332000  PE04044 NHTSA ACTION NUMBER: PE04044  COMPONENT: SUSPENSION:FRONT:SPRINGS:COIL SPRINGS ) HE CONTACTED THE MANUFACTURE AND STATED THAT HE WAS EXPERIENCING THE PROBLEM EXPLAINED IN THE RECALL BUT ON THE REAR OF THE VEHICLE NOT THE FRONT.  THE MANUFACTURE STATED THAT THEY WOULD NOT BE RESPONSIBLE FOR THE REPAIRS. HE STATES THAT SINCE THE PROBLEM HAS BEEN RECALLED ON THE FRONT IT SHOULD ALSO INCLUDE THE REAR.  THE VEHICLE IS CURRENTLY BEING REPAIRED AT A REPAIR SHOP.  THE CURRENT AND FAILURE MILEAGE WAS 88,000. BL               UPDATED 10/5/09 *CN  UPDATED 10/07/09.",
        "vin": "1FAFP55S8YG"
    }
]