[
    {
        "components": "AIR BAGS",
        "crash": true,
        "dateComplaintFiled": "07/05/2017",
        "dateOfIncident": "07/18/2015",
        "fire": false,
        "manufacturer": "Hyundai Motor America",
        "numberOfDeaths": 0,
        "numberOfInjuries": 1,
        "odiNumber": 11003115,
        "products": [
            {
                "manufacturer": "Hyundai Motor America",
                "productMake": "HYUNDAI",
                "productModel": "ELANTRA",
                "productYear": "2016",
                "type": "Vehicle"
            }
        ],
        "summary": "2016 HYUNDAI ELANTRA WITH INVOLVED IN INJURY ACCIDENT 07/18/2015 WITH FAILURE OF DRIVER'S SIDE AIR BAG CURTAIN DEPLOYING. VEHICLE'S OWNER WAS MAKING LEFT TURN WHEN STRUCK IN THE CENTER PILLAR DRIVER'S SIDE BY ANOTHER VEHICLE TRAVELING APPROXIMATELY 60 M.P.H. CAUSING VEHICLE TO BE PUSH SIDEWAYS APPROXIMATELY 10 FEET. THE DRIVER HAD TO EXIT VEHICLE PASSENGER SIDE DUE TO EXTENSIVE DAMAGE TO DOORS AND SUB FRAME.  EXTENSIVE DAMAGE WAS DONE TO BOTH FRONT AND REAR DRIVER'S SIDE DOORS AS WELL AS DOOR SUB FRAME REQUIRING CUTTING AND RE-WELDING IN NEW DRIVER'S SIDE DOOR SUB FRAME, REPLACEMENT OF DOOR HINGES AND BOTH FRONT AND READ DOORS DRIVER'S SIDE.         THE DRIVER'S SIDE AIR BAG CURTAIN DID NOT DEPLOY AND COMPLAINT WAS FILED DIRECTLY TO HYUNDAI AMERICA CUSTOMER SERVICE. THE VEHICLE WAS INSPECTED BY A HYUNDAI ENGINEER AND WAS NOT TOUCHED BY THE BODY SHOP AS PER HYUNDAI'S INSTRUCTIONS. HYUNDAI ENGINEER TOOK MEASUREMENTS, PHOTOS AND DOWNLOADED BLACK BOX DATA BUT THIS INFORMATION HAS NOT BEEN PROVIDED TO VEHICLE OWNER. HYUNDAI HAS REFUSED TO TALK TO VEHICLE OWNER AND PROVIDE ANY INFORMATION AS TO RESULTS OF INVESTIGATION, TO HONOR WARRANTY REPAIRS OR PROVIDE A SOLUTION TO THE PROBLEM AS OF 07/05/2017 .",
        "vin": "KMHDH4AE6GU"
    }
]