[
    {
        "components": "ENGINE",
        "crash": false,
        "dateComplaintFiled": "06/26/2017",
        "dateOfIncident": "01/19/2017",
        "fire": false,
        "manufacturer": "Kia Motors America",
        "numberOfDeaths": 0,
        "numberOfInjuries": 0,
        "odiNumber": 11001331,
        "products": [
            {
                "manufacturer": "Kia Motors America",
                "productMake": "KIA",
                "productModel": "OPTIMA",
                "productYear": "2011",
                "type": "Vehicle"
            }
        ],
        "summary": "01/19/2017 KIA OPTIMA SX 2011, ENGINE KNOCKING, LOSS OF POWER. TOWED TO ORLANDO KIA WEST (OKW).  03/03/2017, OKW COMPLETED REBUILD OF 2.0T THETA II ENGINE WITH $4000.00 SHORT BLOCK ASSEMBLY PROVIDED BY KIA MOTORS AMERICA. DIAGNOSIS WAS, DEFECTIVE CONNECTING ROD #3 BEARING.  05/26/2017, ENGINE LOST POWER/FUNCTION. OKW DIAGNOSED AS CYLINDER #3 MISFIRE.  06/01/2017, REPLACED #3 FUEL INJECTOR, $600.00. OKW STATED ENGINE STILL NOT OPERATING AS DESIGNED. DIAGNOSED TURBOCHARGER SEAL FAILURE. REPLACED TURBOCHARGER $2810.00. ENGINE STILL NOT OPERATING AS DESIGNED. OKW DIAGNOSED CYLINDER #3 NOT HOLDING COMPRESSION. REASON UNKNOWN.  06/12/2017, OKW OFFERED RENTAL, BUT ONLY IF I PAID IN ADVANCE $2810.00 OPEN TICKET FOR TURBOCHARGER. I REFUSED. KIA MOTORS AMERICA PERSUADED OKW OTHERWISE.  06/26/2017, CURRENTLY IN RENTAL CAR WAITING FOR INFORMATION.  NHTSA RECALL 17V224",
        "vin": "KNAGR4A63B5"
    }
]